{
  "schema": "../contracts/module-gap-analysis.schema.json",
  "analysis_id": "FORGE_MODULE_GAP_ANALYSIS_001",
  "module_registry": "scaffolds/manifest/forge-module-registry.json",
  "summary": {
    "total_modules": 37,
    "implemented": 5,
    "partially_implemented": 8,
    "defined_but_missing": 20,
    "rejected": 2,
    "deferred": 2,
    "build_new": 20,
    "product_completeness_percentage": 37,
    "rewrite_coverage_percentage": 100
  },
  "matrix": [
    {
      "module_id": "MOD-DECISION-CORE",
      "status": "implemented",
      "gap": "preserve existing core contract"
    },
    {
      "module_id": "MOD-ACTION-PLANNING",
      "status": "implemented",
      "gap": "preserve action boundary"
    },
    {
      "module_id": "MOD-TRUTH-GOVERNANCE",
      "status": "implemented",
      "gap": "preserve validators"
    },
    {
      "module_id": "MOD-GOVERNANCE-GATE",
      "status": "implemented",
      "gap": "closed: schema-driven runtime gate enforced by protected build transitions"
    },
    {
      "module_id": "MOD-READONLY-ADAPTERS",
      "status": "partially implemented",
      "gap": "normalize all read model contracts"
    },
    {
      "module_id": "MOD-ADVISOR-WORKSPACE",
      "status": "defined but missing",
      "gap": "build new advisor workspace"
    },
    {
      "module_id": "MOD-MANAGER-WORKSPACE",
      "status": "defined but missing",
      "gap": "build new manager workspace"
    },
    {
      "module_id": "MOD-RELATIONSHIP-INTELLIGENCE",
      "status": "defined but missing",
      "gap": "build independent relationship domain"
    },
    {
      "module_id": "MOD-CONVERSATION-INTELLIGENCE",
      "status": "partially implemented",
      "gap": "redesign around guidance-only contract"
    },
    {
      "module_id": "MOD-POLICY-OPERATIONS",
      "status": "partially implemented",
      "gap": "redesign beyond read adapter"
    },
    {
      "module_id": "MOD-PRODUCT-CATALOG",
      "status": "partially implemented",
      "gap": "define source-required catalog contract"
    },
    {
      "module_id": "MOD-PRODUCT-SOURCE-PACK",
      "status": "defined but missing",
      "gap": "requires owner-approved source documents"
    },
    {
      "module_id": "MOD-CARRIER-SCOPE",
      "status": "defined but missing",
      "gap": "build scope contract"
    },
    {
      "module_id": "MOD-RULE-PACK-CONTRACT",
      "status": "defined but missing",
      "gap": "build rule pack boundary contract"
    },
    {
      "module_id": "MOD-ELIGIBILITY-CONTRACT",
      "status": "defined but missing",
      "gap": "build eligibility contract"
    },
    {
      "module_id": "MOD-CALCULATION-CONTRACT",
      "status": "defined but missing",
      "gap": "build calculation contract"
    },
    {
      "module_id": "MOD-QUOTE-PREVIEW",
      "status": "partially implemented",
      "gap": "redesign adapters into governed non-binding preview"
    },
    {
      "module_id": "MOD-MICK-BEHAVIOR",
      "status": "defined but missing",
      "gap": "build observable behavior contract"
    },
    {
      "module_id": "MOD-MANAGER-COACHING",
      "status": "defined but missing",
      "gap": "build consequence-safe coaching contract"
    },
    {
      "module_id": "MOD-ADVISOR-EXPERIENCE",
      "status": "defined but missing",
      "gap": "build transversal experience contract"
    },
    {
      "module_id": "MOD-COMPENSATION-ECONOMIC",
      "status": "deferred",
      "gap": "requires snapshots and source evidence"
    },
    {
      "module_id": "MOD-RECRUITMENT-PRECONTRACT",
      "status": "deferred",
      "gap": "requires lifecycle architecture approval"
    },
    {
      "module_id": "MOD-HUMAN-APPROVAL-GATE",
      "status": "defined but missing",
      "gap": "build exact-artifact human approval gate"
    },
    {
      "module_id": "MOD-LLM-DRAFT-INTAKE",
      "status": "defined but missing",
      "gap": "build draft intake contract"
    },
    {
      "module_id": "MOD-MESSAGE-SAFETY-VALIDATOR",
      "status": "defined but missing",
      "gap": "build safety validator contract"
    },
    {
      "module_id": "MOD-NBA-REASON-WHY",
      "status": "defined but missing",
      "gap": "build reason-why contract"
    },
    {
      "module_id": "MOD-ADVISOR-LIFECYCLE",
      "status": "defined but missing",
      "gap": "build lifecycle read/reference contract"
    },
    {
      "module_id": "MOD-ADVISOR-CONVERSION",
      "status": "defined but missing",
      "gap": "build conversion receipt contract"
    },
    {
      "module_id": "MOD-ADVISOR-ACTIVATION",
      "status": "defined but missing",
      "gap": "build activation evidence policy contract"
    },
    {
      "module_id": "MOD-REVENUE-INTELLIGENCE",
      "status": "defined but missing",
      "gap": "build revenue/economic evidence boundary"
    },
    {
      "module_id": "MOD-OPPORTUNITY-PIPELINE",
      "status": "partially implemented",
      "gap": "redesign read model boundary"
    },
    {
      "module_id": "MOD-CLIENT-CRM-READMODEL",
      "status": "partially implemented",
      "gap": "redesign as relationship evidence adapter"
    },
    {
      "module_id": "MOD-TERMUX-REWRITE-TOOLS",
      "status": "implemented",
      "gap": "preserve scaffold control plane"
    },
    {
      "module_id": "MOD-LEGACY-REINTRODUCTION-GUARD",
      "status": "implemented",
      "gap": "preserve active anti-legacy guard"
    },
    {
      "module_id": "MOD-LEGACY-FUNCTIONAL-EVIDENCE-INTAKE",
      "status": "defined but missing",
      "gap": "blocked pending owner evidence"
    },
    {
      "module_id": "MOD-AUTONOMOUS-AI-DECISIONING",
      "status": "rejected",
      "gap": "forbidden"
    },
    {
      "module_id": "MOD-GENERIC-CRM-CLONE",
      "status": "rejected",
      "gap": "forbidden"
    }
  ]
}
